painting,domi_emotion,utterance_combined
ivan-shishkin_forest-stream-4,positive,"A shallow sream winds around the trees in the woods.I love this painting, it reminds me of taking walks through forests on warm and peaceful days. i like that it's black and white, it's very artistic.The setting makes me feel peaceful and content."
ivan-shishkin_holy-creek-near-yelabuga-1886,positive,"The dry creek with the trees behind create a wonderful environment in my mind. that, along with the scenary behind the trees makes this into a painting that i would love to have in my home.The height of the trees overwhelm everything below them.Amazing landscape and painting of the trees. the people look very small in comparison to the nature."
ivan-shishkin_last-rays-1865,positive,Sunlight is streaming down from the heavens to warm the earth.The treatment of the light on these mountains gives just the right effect. the sun is partly concealed behind the clouds and the viewer can see rainfall but in the distance.The sun beams down through the clouds like rays of heavens holy light.
ivan-shishkin_oak-forest-1869,positive,"The dark greens of the trees contrast nicely with the brighter greens of the grass.It reminds me of a nice day at the park.I love nature and peaceful scenes like this one.I love how green and sunshiny everything is, in this image. i want to go take a walk here."
ivan-shishkin_oak-grove-in-a-gray-day-1873,positive,"Its a relaxing painting to look at that makes me feel calm.Who would not be content to look at green grass and trees?It is someplace that i would like to be at - calm, warm and serene.Almost looks like a photo, the white wildflowers make it real."
ivan-shishkin_pine-1892,positive,The large tree in the forest makes for an imposing sight.The trees and shadows in the painting look incredibly photo realistic like as if taken by a camera.How many years did it take for that tree to get that big.
ivan-shishkin_pond,positive,The  scenery makes me feel like it is a tranquil relaxing spot.This small lake looks tranquil and serene. it looks like a great place to contemplate or read.The way the horizontal lines gives an impression of a calm lake is amazing and soothing.The creeks gives an old western feel to it that's relaxing.
ivan-shishkin_view-near-dusseldorf-1865,positive,"A clearing on the hill with two boys among the rocks.There is a very beautiful touch of nature conveyed through the light-auras in the background of the clouds and the way it cascades among the myriad of colors in the ground.The ground variety makes this feel immersive from the grass, to the rocks and bits of dirt."
james-mcneill-whistler_crepuscule-in-flesh-color-and-green-valparaiso,positive,"The mixture of different colors to make the sky and ocean scene is immaculate.There are so many ships so close together.Serene view of a harbor, all done in vibrant blues, greens and purples. it shimmers  in the dusk."
james-tissot_caricature-of-james-delahunty-m-p,positive,"The exaggerated hat and head of the human along with an over-compensating, mimicry of dignity creates the sense that this human is actually quite conceited and dealing with an inadequacy-complex of some kind.Seems like a funny short guy with a really high top hat.The smirk on his face seems as if he thinks a lot of himself."
james-tissot_statesmen-no-380-caricature-of-archibald-campbell-tait-archbishop-of-canterbury,negative,"The man looks rather sad with the way his hands clasped together.The look of the man is quite somber and sad as he looks on with the black coat.I feel sad looking at this because this man's facial expression and body language are just plain depressing. he looks like he just came back from a funeral.The man appears to be praying, as if he is sad and down on his luck."
james-tissot_the-comedian,positive,"This portrait of a noble makes one laugh at his foppish attire and idiotic pose.The man looks confused, and he is holding a purse.I guess his upper body is cold but he's hot below the waist."
jean-francois-millet_women-carrying-faggots-1858,negative,The down trodden travelers seem quite exhausted as they trudge forward with their packs.The women seem so weary as they carry their heavy loads on their backs.The two ladies carrying the hay look exhausted and miserable.
johan-hendrik-weissenbruch_beach-view-1891,positive,The ominous clouds seems to be accompanying the lone travelers.The black horse carriage moves steadily forward.The sunlight feels warm and the scene feels calm.
johan-hendrik-weissenbruch_the-bleach,negative,"The house is in disrepair and the woman appears to be poor.The gloomy clouds look rather depressing and dark.The house seems rather run down and breaking down, which is pitiful.The woman isn't wearing any clothes appropriate for the rain, even though it looks stormy and cloudy."
john-singer-sargent_cecily-homer-1910,positive,"The subject's dark hair blends into the background, so it makes her face pop. she looks happy.The woman looks like she wants to grin and she is proud of her blouse.This gal is clearly daydreaming, i hope it's a good dream."
john-singer-sargent_miss-ellen-terry-as-lady-macbeth-1889,positive,Her red hair is really long down past the waste on her dress.The woman's posture gives a strong sense of majesty.She feels like a queen as she takes the crown and power on the throne!
john-singer-sargent_portrait-of-albert-de-belleroche-1882,negative,"There is a dark shadow over the man's face as if he had just lost something important.The downward gaze of the man symbolizes depression.This man looks like he's not fully present, since his eyes are glazed over."
julius-leblanc-stewart_an-english-lady-1896(1),positive,The woman looks delicate since she's wearing a veil over her dress.The painted transparency on the shaw seeing the skin underneath and the multiple folds contrast with her skin nicely while also matching her bow.  the dark background makes it all pop really well.The eyes of this woman make one feel as if she is looking right at them.
julius-leblanc-stewart_an-enthralling-novel-1885(1),positive,The attention to detail in this painting and the painting of someone reading is peaceful.The detail in the woman's interest of the book is quite awesome.The women seems content to read her book all day.This lovely woman in white ruffles is enjoying her book.I love the fine details of this painting especially on her blouse.
julius-leblanc-stewart_nude-in-an-interior-1914(1),positive,"This is one attractive lady showing off ample bosom in her yellow gown.A shapely beauty who's not been going hungry.This woman's day is full of possibility, since she's getting dressed in her finest clothes."
julius-leblanc-stewart_the-ball(1),positive,A very beautiful night in the ballroom with men and women dressed gorgeously.The gathering seems to be quite lively and exciting with all the individuals together at the ball.The gay crowd in the ballroom dance enthusiastically.There are many different colored dresses. there are are a lot of people. looks like an exciting party.
kazimir-malevich_portrait-of-mother,positive,The wona's white hair and light complexion creat a stark contrast against the dark background.The woman seems quite well traveled and her expression seems to show her experience.This woman looks like she is relaxed and deep in thought; very calming to see.
klavdy-lebedev_spat-on-the-terrace,negative,"The way the young girl in the red and white dress is looking down and grasping her shawl makes it seem that the other women are mocking or chastising her.One of the women is kneeling, as though she needs to scrub the porch by herself.This reminds me of when my mom would yell at me when i was a kid.I feel sorry for the girl, looks like she is being attacked and accused of some wrongdoing.The girl looks like she is ashamed and sad.  like she is being accused of something very bad."
klavdy-lebedev_svyatoslav-s-meeting-with-emperor-john-as-described-by-leo-the-deacon-1916,negative,The people have very stern looks on their faces and the man in the boat feels like he is being banished.There appears to be some sort of hostilities being presented between the differing groups of people.I don't have a way to contextualize this subject so i don't understand who these men are but they look angry and mean so i don't like having to look at this painting since it isn't pretty either.
konstantin-makovsky_flowers-1,positive,"This painting makes you want to reach out and touch it . the realism is amazing and the dark background highlights to lush greens and golden oranges, and yellows used in the bunch of flowers..Green and yellow flowers signify wildness and natural strength.A vibrant colorful still life with climbing green vines, bright red and yellow flowers and a dark contrasting background."
konstantin-somov_portrait-of-n-vysotskaya,negative,"This sketch is actually a little unsettling, mainly because of how the woman's left eye seems like an absence. it's too dark as though there is something wrong.The woman has a sense of sadness around her.A painting of a very beautiful woman looking very sad.The simplicity of this picture shows the grief in her face."
konstantinos-volanakis_argo(4),positive,"The clear blue skies make it a nice dy to go on an adventure.Nice detail on the ship such as shields strap to the bow, a warrior with a spear, and sun cover over the stern.The reflection of the boat in the water is interesting as it creates new colors."
konstantinos-volanakis_naval-battle-at-lissa-1869,negative,The large ships are on fire.  it is obvious the choppy sea is making it difficult for the life boats to rescue those in the water.The ships looked like they are batted out like toys and the people in the canoe look so fragile.The smoke and sinking ship amongst the choppy waves appear violent and frightening.The dark plumes and redish tones make it look like battle ships going through war.The picture depicting a sea battle with it's dark forboding colors leaves you felling ominous.
m.c.-escher_not_detected_204701,positive,The triangular patterns contrast well with the horizontal lines of the sky.The architecture of the buildings in this image is admirable.The carving is very intricate and realistic looking.
martiros-saryan_armenian-mountains-1962,positive,"I like the hard rugged mountains and the open plains.This open landscape looks at once mysterious, inviting, quiet, and calm.This is a very relaxing painting with its simple lines."
martiros-saryan_dvin-excavations-1952,positive,I am curious as to what these people are doing on top of the hill.The land is a happy yellow color and it is inspiring the people to work happily.Very bright color. people are working. looks pleasant.
martiros-saryan_flowers-lemons-oranges-1953,positive,The soft palette of colors and textures in this still live of flowers and fruit creates a soothing image for the viewer.Shows pots of flowers and fruit right next to it.Nice bouquet of flowers with some randomly assorted lemons and other fruit. i could see this painting in my kitchen.
martiros-saryan_village-at-the-foot-of-the-mountain-1937,positive,"I like the details in the drawing, the little town and the mountains.This is a very serene drawing of a small mountain side town.I like the pencil detail of the streaks of on the mountains, and the trees, and the tiny village in the center. soothing."
mary-cassatt_bacchante-1872,positive,The woman is very gorgeous as she seems to be playing beautiful music.The look in her face is like she is peacefully playing some music for someone.The woman wears a beautifully adorned dress and bears a sober expression.
mary-cassatt_portrait-of-a-lady-miss-my-ellison-1877,negative,The child looks like a boy dressed in girls clothing.The small child almost seems like they are trying to hide from someone or something.The child with fan in hand looks to be sad.
mikhail-lebedev_in-a-park,positive,The yellows is like the sun is raiseing and its the start of a new day.The swamp looks enchanted with it's yellow glowing light.The image of the trees looks unreal and the colors looks as if the river is glowing in makes you imagine if you were there relaxing in the light of the trees.
mikhail-vrubel_anna-karenina-meets-her-son-1878,negative,"The look on the woman's face is dark, intent, and the child looks afraid or angry!The woman looks as if she has bad intentions with the baby.They greyscale colors and the way the woman is holding the child make me wonder if she is the mom."
mykola-pymonenko_going-home,negative,"The woman hiding her knife behind her back makes her seem very untrustworthy.There is a wonder about what is going to happen next, with the item that the woman is holding behind her back.The woman is going to beat the man with the stick."
n.c.-wyeth_knife-fight-between-pirates,negative,I do not like the fact that they are fighting.The fight appears intense and scary to watch.That man is about to stab the other man!
n.c.-wyeth_the-unwrit-dogma,positive,I want to know the secret that the fat men are discussing over tea.The mischievous look on the men's faces and bright colors make me laugh.The men are drinking tea and happy to be close to each other.
nicholas-roerich_skulls-1901,negative,"I can imagine these people's pain as they appear to have been brutally murdered.The assortment of skulls feels ominous and the hole and cracks in some of the skulls seems eerie.Skulls on spikes is a very disturbing and scary image.This painting inspires fear.  it looks as if skulls are impaled upon sticks.  the simple black and gray makes this feel threatening.  it appears as if the skull in the top right has a bullet hole in it as well so could this be the aftermath of a tyrant?Skeletons on sticks are a eerie, spooky and scary sight."
nicholas-roerich_walls-of-kremlin-in-novgorod-1903,positive,"The wall of the castle seems to not have been breached by any intruders.I feel awe as this is the great wall of china.  the sun light suggests it is at sunrise or sunset.  i bet that is lovely in real life.The details in the art is really good.It reminds me of the great wall of china, but in a desert.The use of color and shadow gives this painting depth and a sense of realism that is amazing."
nicolae-vermont_the-red-scarf-1925,negative,The expression on the woman’s face looks sad. it seems like she is trying to hold back tears.The woman in the painting looks very somber.The woman not making eye contact with the camera looks oppressed.Her eye looks red as if she has just cried.The female here looks sad and is about to cry.
nikolai-ge_florence-the-cascina-park,positive,"The mix of greens is absolutely breathtaking and well done.The trees seem to be parting to a yellow like glow.It isn't easy to do a monochromatic painting and have a lot of light and depth, and they really pulled that off here."
nikolai-ge_frascati-clouds,positive,"I feel like i am visiting a beautiful country home in the foothills during the late summer.The prairies look very still, calm, and peaceful.The hay is a bright golden color that reminds me of abundant fields of wheat."
nikolai-ge_not_detected_252984,negative,"The dark colors, his expression and pose makes him look sad.The woman's mouth is covered so she can't breathe.The man looks like he is missing someone and is sad that they are gone.He looks sad and lonely so i feel for him.This is very sad. this person looks lost or homeless. they look cold; by the bright red blanket and the blurred hint of a scarf around the face."
nikolai-ge_portrait-of-adam-olsufyev,positive,"This is a portrait of a man proud of his accomplishments and relaxed with a hand in his pocket smoking a cigar.The dark, bold colors of the painting make me feel proud of the man.A fairly old man dressed in military clothing.This man is very richly appareled. perhaps he is a general."
nikolai-ge_portrait-of-the-ukrainian-boy,positive,"The back ground looks so peaceful, i see why the boy is resting.A kid sitting on top of a barrel in a natural area full of grass and plants, he's sitting close to an intrance.This little boy loves the farm life. he is wearing a suit and tie and sitting on a bucket."
nikolay-bogdanov-belsky_talant,negative,The artist must deeply depressed while working on this art. the old man's hand position and the womam's eyes are saying many things but sad.He reminds me of a old man that just lost someone and his grandson it comforting him with music.The man looks as though he is despair and the musician looks desperate.The man looks like he's exhausted since his head is in his hands.
nikolay-bogdanov-belsky_talant-and-admirer,negative,"The man appears to be disappointed with the boys performance. the boy appears to be trying his best.The contrast of the man and the child is exquisite. the man, in darker colors, shows how much he has sacrificed and makes me feel sad. the child, in ligher colors, however, gives me hope for the future. very nice contrast with one another.The old man has his head hung like he is crying and the colors of the painting are so dark and somber."
odilon-redon_vase-of-flowers-12,positive,"The beautiful flowers give me a sense of well being, it reminds me of sitting on the back porch admiring the flowers in spring.The bright, vivid colors of the flowers against the golden background are warm and inviting.This many colored flowers remind me of an easter morning in spring.The colorful flowers make a lovely companion with the dark blue vase.This bouquet of bright wildflowers makes me happy with it's sunny yellows and rosy reds. piled high in a blue pottery vase it's effortless, pretty, and shows off the bounty of spring and summer."
peder-severin-kroyer_fishermen-hauling-the-net-on-skagen-s-north-beach-1883,positive,"All of the men putting in effort makes it seem like there's a big catch off-canvas.These men are working hard and that is respectable, they look to be giving a great effort.It's colored and drawn so well it looks life like almost."
pyotr-konchalovsky_in-the-cathedral-of-yuryev-abbot-bessarion-1926,positive,"This painting makes me feels...content looking at this ritual, possibly a baptism.The man's fancy  attire makes him seem like he's a religious figure.The boy's white crossed robe creates a strong focal point."
pyotr-konchalovsky_still-life-1947,negative,The big brown bag in the back looks like a dead turkey just sitting on the turkey.Someone likes garlic and wine. i hope they not eating that together. yuck.The food looks too much like they are fake.
pyotr-konchalovsky_still-life-basket-with-ash-1947,positive,"The dark red really contrasts against the white cloth.The picnic basket is filled with tiny red berries that are ripe.The basket with fruit in it reminds me of a picnic setting, and maybe someone was picking berries."
pyotr-konchalovsky_still-life-meat-and-poultry-1936,negative,"Slaughtered, partially slaughtered, and dead animals and fowl on a table and hanging from a wall isn't very pleasant to observe.The hanging meat is really creepy and makes me think of the smell.To see the butchered animals cut open is just gross.  i'd rather seem them all together or on a plate fully cooked.The looks of the dead animals make me feel yucky after seeing their guts all over the table.The animals are dead, entrails showing, and i can imagine the smell.The cut open animal on the left makes me feel the most disgust, as well as the way their bodies are hung. although i'm a meat eater, seeing these animals being prepared for butchering is disgusting. i find the way that their bodies hang limply extra off-putting.There is something unnerving about skinned rabbits that bothers me.I feel disgust because there are dead animals hanging from the wall. there even appears to be blood still on one of the animals that is hanging.Dead farm animals hanging on a wall and shelf is gross and disgusting.The skinned chickens and drooped chicken heads have a grotesque effect.The dead birds hanging are pretty gross.The dead animals look sad and really gross because you can see inside of them.There are dead birds in this picture and it makes me feel queasy and uncomfortable.The dead animals on the counter make me sick and make me wonder who did this.The de-skinned carcass of a butchered animal makes me feel rather sickly.The carcasses of the animals make me feel both sick and saddened.Several dead birds and a goat gutted and hung give a stark portrayal of what pantries once may have looked like.The dead animals are painted with such graphic details, it's hard to look at. especially the goat and its head. i owned goats as a child and i couldn't imagine eating them.The dead chickens are horrific to me.The painting realistically depicts what looks like a bunch of slaughtered animals.The dead bodies of the animals make me feel icky due to the guts being spilled.The animals are done well enough that you can tell what they are, but personally i do not find the subject matter appealing. it's frankly kind of gross and off-putting. i would not enjoy seeing it or spend much time observing it if i did. what looks to be a pile of bloody rags on the left side makes me want to not look at it any longer.If anything could make me a vegetarian, this picture of slaughtered animals might just do it.I eat meat but i don't appreciate it being used for decoration.I do not want to see these animals destroyed and gutted, absolutely gross.The birds in various stages of dress is gross.The animals on the wall look very bloody and would probably smell.The arrangement of dead animals is gross, like a morgue for critters.I am disgusted at the dead and bloody chicken and the carcasses. this is a morbid scene that makes me question my unethical meat eating practices that i try to suppress.These dead animals hanging her look gross. i do not like dead bodies of any animal.The bodies of the dead animals are displayed in a gross unappealing manner."
pyotr-konchalovsky_sunrise-1923,positive,The moon is starting to peek out from its place in the sky.The different shades of green and yellow are pleasant against the sky.The natural colors are calm and relaxing.
pyotr-konchalovsky_the-tops-of-the-birches-1940,positive,I like the tall trees and the way they reach toward the blue sky.The bright green trees goes well with the blue skies.The blue skies highlight the white birch trees.
pyotr-konchalovsky_willows-1947,positive,The trees look really soft since the brush strokes were applied so quickly.The colors are peace full and i can almost smell the fresh air.This painting makes me feel contentment. it looks like a beautiful spring day and the blues and greens are such a calming combination.
salvador-dali_aurora-s-head-after-michelangelo-detail-of-a-figure-on-the-grave-of-lorenzo-di-medici,positive,"The stones, architecture, and artwork look old and carefully done, it provokes respect and interest in the setting.The scene looks uncomfortable and maybe painful but higly spiritual.Sort of a baffling piece, is this a photograph of art at the end of the stairs? or is the entire piece the artwork? makes one wonder."
salvador-dali_rocks-of-liane-first-version,negative,I feel as if there is dark things on the horizon.The dark colors and tone of the picture make me worried about the woman being in the water by herself.The black-and-white tone with the creepy landscape and mysterious woman makes me a little afraid.
theodor-severin-kittelsen_bjoernen-og-reven(2),positive,It is hard not to laugh when you see a bear hugging a pig.It looks like an old comic drawing style and it is kinda simple.This is an interesting picture reminds of a friendship between a bear and a pig (bighug).
theodore-gericault_anatomical-pieces,negative,"The pieces of meat look bloody, and they seem to be decaying.It is disgusting, the butchered parts of body parts all stacked on top of each other.Looks like dismembered bones.The painting depicts a lot of chopped up body parts.This painting seems to depict large chunks of human flesh."
thomas-eakins_a-negress,negative,The little black boy looks like he's in extreme pain.A gloomy looking black lady without clothes on.This woman has a weird look on her face and she is naked. those two things combined make me uncomfortable.
thomas-eakins_an-arcadian,positive,I like the details of the person lounging in the sun surrounded by the green landscape.This person is sitting in partially cleared area. they look like they are reflecting on their life.This man is in his toga enjoying the outdoors and the fields here.
thomas-eakins_illustration-for-neelus-peeler-s-conditions-1879,negative,"That poor kid just wants someone to pay attention to him.There is an air of poverty and resignation about this scene, especially from the child on the floor.A black and white picture of a family sitting on the dinning room of the house, the man is sitting close to the table, while the woman is working on some clothes."
thomas-eakins_study-of-a-girl-s-head-1869,negative,"The woman looks lost in the darkness that surrounds her. like she is contemplating a lot right now.Her face is barely articulated and she is staring down and her edges are fading into a kind of blackness.Clothed in nothing, she drew her folded arms into her chest and looked at the floor."
thomas-eakins_study-of-an-old-man-1911,negative,"The mans hands look wrinkled after a long life of work.The old man's hands are worn from many years hard work.The man looks old and tired. his face lacks detail in his eyes, which is a bit unsettling."
thomas-eakins_the-chess-player-1876,positive,This was the most intense game of chess they've had between them in the last 40 years.The men playing a game of chess makes for an exciting sight.Edison and tesla decide to settle the issue of who will control electric power over a game of chess.
