painting,domi_emotion,utterance_combined
jules-lefranc_mayenne-a-change,positive,"The small house on top of the hill makes me content since it looks like a peaceful place to live.The water next to the grassy hill and trees are all very peaceful.This is a simple scene, but filled with tiny details that make it come together so well. i like this a lot."
jules-lefranc_morlaix-brume-matinale-1943,positive,"A painting that lets one step back in time with a historic scene filled with tranquil colors and a clean appearance.It amazes me the ship could sail so closely to such large buildings, and yet the design of it is immaculate.The color of the water and the reflection are beautiful."
kazimir-malevich_we-went-from-the-kovno-1914,positive,"This reminds me of a cartoon scene and is cheerful.I am amused because of the rudimentary qualities of the painting.  the cannonballs, soldier, and hills all look like they could have been drawn by a junior high student in a mandatory art class.The smiling face on this man makes him look like he is very happy at whatever he is seeing.The whole picture seems funny. the horse looks like he is smiling and the man looks funny."
louis-vivin_les-invalides,positive,"I like the colors in the image, they're not too bright so it's not crazy, but at the same time it looks like a peaceful scene.The lines in the painting are symmetric which is satisfying.The depiction here of a building is pleasant and polite while being genuine."
lyonel-feininger_trumpeter-trompeter-1918,positive,Though the black lines are stark the character and toy(?) look playful and whimsical.The man seems to be much bigger than the city he is standing in.A giant standing over a village is really interesting.The man looks funny as he holds onto an object.I see a giant getting ready to play a brass instrument for a village below.It makes me think of a giant weight lifter.
marc-chagall_a-man-with-thora-1975,negative,"The dark colors and shadows make the man look like he is bothering the woman and child.Dark and brooding, and the expressions on the faces of the woman and child suggest the man is a dirtbag.The dark, distorted figures and heavy use of blacks look foreboding."
marc-chagall_arrival-of-queen-sheba-to-jerusalem-i-kings-x-1-5,positive,This image intrigues me because it looks very light and delicate yet seems to be telling the story of a strong march.The people are going to the queen thats on top of the camel.What a great image of a king welcoming his visitors into his kingdom.
marc-chagall_coachman-feeds-a-horses,positive,The hores look very funny like they are making jokes.The man is looking like he's trying to feed his horses.The oddly shaped characters are amusing to look at.
marc-chagall_creation-1980,positive,"The sketches are fun and whimsical around the naked figure.The way the figures intermingle is fun and interesting.This scene looks sexual, since the woman is nude and her breasts are showing."
marc-chagall_david-1956-1,negative,"This painting is very crude, and it is difficult to ascertain what the subject is doing. it does appear that he is holding a human head in his hand, which is rather gruesome. it looks like a child drew this picture.Holding a head of a decapitation is just sick.It is terrible. looks like he is holding another head but whoever drew this is 5 years old."
marc-chagall_eliezer-and-rebecca-1931,positive,"It is so crudely drawn that it makes me think my little niece has created artworks of way higher caliber than this, and i wonder who decides what is going to be expensive art.The monkey riding the camel is funny and ironic.Simple art style, and the faces of the subjects look funny."
marc-chagall_elijah-resurrects-the-son-of-the-widow-of-zarephath-i-kings-xvii-17-22,negative,The dark colors and woman in bed remind me of death.I see a woman grieving a loved one who is ill and possibly dying.A woman seems to be crying at the death of a woman on the bed.
marc-chagall_isaiah-s-oracle-on-the-ruins-of-babylon-isaiah-xiii,negative,All the dead people on the ground and the dark colors is grim.The dark sky and bodies of the dead make me fearful of what has happened and what will happen next.The figure on the top looks like it is shrieking. there appears to be a battle scene. it is scary.
marc-chagall_joseph-is-attacked-and-robbed-by-his-brothers-genesis-xxxvii-23-24,negative,"The dead man's face has a fixed gaze of horror as does that of the men watching.The man is being attempted to bury alive.Are they burying this man alive?  why are they stripping him?The man at the center looks like he's being humiliated, since others are stripping him of his clothes and thus his dignity.The subject matter seems upsetting, something bad is happening in this picture based on the expressions. the goats are smiling though?"
marc-chagall_moses-receiving-the-tablets-of-law,negative,"This man is trying to reach out from beyond the grave to warn others about his mistakes.The black and white is very striking but the main figure in this is a little scary.The figure on the left looks to be a terrifying ruler, and the darkened shadows further amplify this.It looks like demons flying towards gravestones or souls."
marc-chagall_moses-spreads-death-among-the-egyptians-1931,negative,"Appears to be a scene of death and destruction with the main person being of jewish origin reaching his hands towrd god in pleading.I feel like he is raising his hands in despair for something that he and his need.  i feel for him.Reminds me of a zombie trying to capture me,scary."
marc-chagall_moses-with-the-burning-bush-4,positive,That angel is buff and on fire and the old man in green is so indifferent its great.They have such bright and distinct personalities through the colors chosen for the art.The simplicity of the sketches and the inexact application of color make it look like a rough draft..
marc-chagall_selifan,positive,"The way that it is sketched, it looks like a child drew it. the man is very overexaggerated.The awkward-looking mechanic works on a carousel horse.Both the man and horse look like they were drawn by children."
marc-chagall_solomon-is-proclaimed-a-king-of-israel-i-kings-i-32-40,positive,The soliders celebrate their leader in the homecoming scene.At first i thought this was a battle scene but as i looked again it appears to be a celebration of the return of the guy on the horse.The king has come home on his horse and the people are ecstatic.The horns and upraised arms around the crowned figure make it feel like a triumphant procession.
maria-primachenko_an-outer-space-memory-1977,positive,The colors pop off the screen and its exciting to look at all the flowers and stars in different patterns.This painting is like a nightime sky lit up by stars and fireworks.Love the bright colors. love the zinnias and other flowers.  almost symetrical.
maria-primachenko_black-beast-1936,positive,"This painting is certainly of flight into fantasy.  the strange creatures really catch your attention.  i love the circular shapes on the black creature.I love the monster, or maybe it's a dinosaur, it's very original and not like anything i've ever seen before.I love this painting. it's incredibly unique and interesting."
maria-primachenko_black-monkey-1936,positive,"The colors and spacing remind me of a quilt or fabric sample. it's colorful and fun and silly. makes me happy.I cannot tell what type of animal this is, but it looks incredibly hilarious.This looks like a designer bag patterned monkey."
maria-primachenko_tiger-laughs-1982,positive,"The strangeness of this cat, the ridiculous costume he is wearing and the mouth hanging open surrounded by the bright imagery and flowers looks amusing.This is a picture of a funny looking cat which i find amusing.Scary cartoon cat! an angry cat in a sweater.could be why he's so mad.funny."
martiros-saryan_illustration-to-armenian-folk-tales-1937-7,positive,The beaten man on the floor. the women with the sword on the horse.When men were men and handling their problems with swords.The horse standing on top of the screaming man is so brutal.
maurice-prendergast_summer-day-1,positive,"Looks like there is a social gathering under trees filled with green and blue foliage.Looks like a small social gathering under some happy trees.Even though this is very abstract, i enjoy the blues in the trees and water."
maurice-prendergast_village-against-purple-mountain,positive,"This reminds me of a finger painting that my small children would bring home.Although this is probably a 6+ figure work of art, it feels amateurish to me like a fingerpainting from a 5 year old.The bright, yet dark fall colors used for the tree's and background give me warmth."
natalia-goncharova_linen,positive,"Villagers work pleasantly on textiles amid two wandering geese and an appealing sunrise.Such great vibrant color, i like how the white lines are being laid down, like theyre about to play a game.Beautiful colors, this painting express feet of working women's in my opinion.The setting is very picturesque with very comforting and warm colors.Three women spreading out clothes and two white ducks playing around.The women working on the tree and the garden makes me feel calm and relaxed."
natalia-goncharova_liturgy-the-seraph-s-costume,positive,"A man is trying to fly in his cape that has 2 pictures of 4-eyed people.The person in the center literally has eight eyes watching their back.The bright colors, the precise, sharp lines and shapes, the many eyes, and how it all floats.The colors are bright and the faces and feet are amusing.A funny painting that resembles a disney world movie."
niko-pirosmani_big-marani-in-the-woods,positive,"The grapes on the trees makes it look more real.This suggests fecundity and plenty, a time of harvest.An interesting look to the house in the background."
niko-pirosmani_razzle-dazzle-during-the-grape-harvest-1906(1),positive,The man without pants and leashed bear are so out of place!I find this image amusing.  the man with the short shorts looks silly.  i find it funny that there appears to be a bear being made to walk on two legs. and its funny that in between these things there appears to be a dinner party going on. its so odd like alice in wonderland.People are eating eith crazy stuff going on around them.
niko-pirosmani_the-tiflis-funicular,positive,The green mountain looks very big because of the small house at the top.The shading in this painting gives it a good sense of depth.The over saturation of green makes the barns stand out.
otto-gustav-carlsund_dresdens-spektrum-spader-dam-1922,positive,"The makes me feel happy and reminds me of playing poker with friends in guam.This is a stay at home mothers game card, i can totally relate.The queen of spades wields a bucket and a scrub-brush?  if is an amusing juxtaposition between our expectations of someone whose face would be on a card, and the person in the piece of art in front of me.  i chuckled a little.The cartoon like woman dressed in rust and black clothes on a playing card? a brush and bucket at the top of the card is she gambling in her head whether she will clean today?"
pablo-picasso_a-bank-of-canal-1905,positive,"Its a bit overly simplistic and the colors aren't very appealing, but the painting also carries somewhat of a quaint atmosphere to it. it's as if these are just small-time people who know each other saying hello for the day.The three people chatting together seem to be enjoying each others company and conversation.The sketchy nature of this makes it feel very personal and the sepia/grey tonality makes me think of old fashioned photography.The simple painting of people greeting one another near an amsterdam canal is calming."
pavel-filonov_landscape-with-two-animals,positive,"The way the picture is drawn reminds me of current day cartoons.When you look closer things on the farm look too big or out of place.I'm amused by what i'm seeing , how the picture looks good made from charcoal."
radi-nedelchev_winter-night-1971,positive,"The shading on the hills in the background make them pop off the page.This scene has warm yellow lights to contrast the cold whiteness of the snow.A happy winter scene, makes me think of christmas time - the snow and lit-windows is very joyful."
radi-nedelchev_winter-village-1969,positive,The details of the tree and simplicity of the houses.It looks like a happy village during the holiday season.The tracks in the snow are realistic.The curved look of the painting and the colorfulness make it feel very whimsical and happy.All of the carriages and people out makes me think of a happy christmas scene.This makes me think of a christmas story book.
raoul-dufy_boats-in-le-havre-1926,positive,"So much activity here, it's watching the democracy process of the bigger and stronger taking it all in action.This painting reminds me of picasso's starry night.All the boats look like they are about to start a race."
seraphine-louis_unknown-title,positive,"Lots of color and movement in this painting makes me think of windy, spring days.Looking at this i cant get over the bold colors and how you really have to look to see if its a bird or a branch with alot of leaves on it. i like the little bird almost hidden under the big bush.A tree with leaves of a million colors. the colors are wondrous and the painting looks joyous."
tarsila-do-amaral_a-gare,positive,"A cubist portrait using bright colors evocative of childhood.This work is bright, happy, and childlike. there is an animated train and it is very colorful.The bright colors and geometric shapes gives a cheerful impression of a very busy environment.The bright array of colors really make this picture pop.The perfectly rounded circles and the perfectly square rectangles are interesting.Wonderful, a colourful painting of a train, very child-like.This bright piece of art reminds me of a church glass window that would illuminate when the sun shines through it.This looks childish but fun at the same time, the colors are cheerful looking.Lots of ginger tones are used in the trains, lights, and side walk."
tarsila-do-amaral_a-negra-1923,negative,"A naked woman sitting with her legs crossed and her right hand separating her breasts.A ancient species staring off at you.Creepy looking ,asexual  creature with a distorted body and a odd expression."
tarsila-do-amaral_pastoral,positive,This looks like an image of a child and their grandpa; really nice to see this!It looks like an awkward picture of father and daughter.It's a peaceful image of a man and a child.
viorel-marginean_peisaj-2009,positive,"The bright colors and contrasting forms in this image are interesting to look at.I love that the trees are colored like fall and i love the view of the fields from above.I love how the colors are so bright! the bright greens and oranges in this image add lots of energy to the picture.This is such a happy painting, the green hills dotted with red trees, i love the buildings tucked away in the glens, the birds add a carefree feeling.All of the colors just pop when they are together giving me a feeling of excitement.The isometric perspective, birds shown mid-flight, and the detailed three-dimensional depiction of the hills are thrilling."
william-h.-johnson_children-at-ice-cream-stand-1939,positive,This group of kids look like they are having a good time. they are all wearing colorful clothes.A group of people looking an old man.This is a cute and familiar scene that is also child like. it is a happy scene that brings me good feelings.It feels cheerful because it's a bunch of friends getting a snack.
william-h.-johnson_ski-jump-1946,positive,The motion of the skiiers jumping up on the snow with the vibrant colors make me feel excited.The individuals in the painting on skis look as if they are competing intensely.The dynamic skiers all flying through the air and the snow falling off of them makes me think they are going very fast and this is exciting.
yiannis-tsaroychis_illustration-for-cavafy-s-poem-lovely-white-flowers-1964,negative,One man is dead and the other in mourning. the sad scene depicted creates sadness.A man touches the arm of a woman in a coffin. it seems strange that he is smiling. they both look naked. it depicts death and loss.The mourner is expressing sadness at the loss of a friend.
edward-hopper_adam-s-house,positive,"It shows a nice neighborhood.Looks like a nice day to take a walk.It seems to be a pleasing place and as the telephone wires imply, partially modern.This reminds me of my home town, and i love it. it captures the beauty of living in a small town."
edward-hopper_drug-store-1927,positive,"Of all the things to advertise, this artist chose ex-lax.Well its an old ex lax advertisement on a drugstore window. i think its kind of neat.The subject is nostalgic and amusing.  the contrast of colors, the lights and darks that depict a street corner at night is interesting."
edward-hopper_lighthouse-at-two-lights-1929,positive,I love beaches and lighthouses and the serene feeling they bring us.The sky and scenery look very peaceful.It makes me feel calm because of the colors and the cute little house.The day looks like it could be sunset and the light house looks well kept and clean.
edward-hopper_study-of-a-seated-woman,negative,"She just looks so sad and forlorn.The woman looks to be sad.I feel sad for the woman in this picture, as she looks angry.  it's possible she's angry about how ugly her dress is. the diagonal lines also depict anger to me."
edward-hopper_the-bootleggers,positive,This looks like a relaxing ride to me.The ocean and voyage are relaxing.It is nice that someone waiting at the house outside for the men in the boat.
john-french-sloan_rosette-1913,positive,The subject matter is relaxed and the color is soft.The face is very thoughtful.The woman looks calm and peaceful.
john-french-sloan_spring-grammercy-park-1912,positive,This person looks happy to be raising a child in a beautiful city.This painting is very relaxing in its imagery and colors.This painting is cool and colorful.The two woman with the baby seem happy and having a nice stroll.
john-french-sloan_the-city-from-greenwich-village-1922,positive,"I love this exciting 1920s ny city scene. even without the caption it would have invoked ""vintage new york"" feelings in me.Trains are always exciting.Love this! i love trains. i love el trains even more. this takes me back to my early 20s when i lived by the el in phila. this picture brings back such great memories!"
john-french-sloan_yellow-rock-gloucester-1915,positive,"Te contrast of the colors of the water and the rocks and the overall theme is awe inspiring.This style of painting feels messy, yet at the same time beautiful.This makes me so happy. it reminds me of home but when i'm not working and enjoying the beach and the rocks."
william-james-glackens_bal-bullier-1895,positive,The people in the image look is af they are about to dance.Amusing that it looks like french renaissance painting. they are all wearing black. she looks to be much bigger than her partner. they are all walking towards something or about to break out into a dance at their local nightclub. they are about to do somethings with their fancy dresses and hats and everyone seems amused too.They look like they are dancing .The party-goers are watching the two people in the center dance.
albrecht-altdorfer_birth-of-mary,positive,Very peaceful with the flying angels over a mother holding her child.Seeing all the baby angels surround the baby is quite awe inspiring.The way the figures are looking down on the scene from above suggests reverence.
albrecht-altdorfer_susanna-in-the-bath-1526,positive,The detail in the castle.There are a lot of interesting details.I wish i could see architecture like that nowadays.
albrecht-altdorfer_the-battle-of-issus-fragment-1529-5,positive,"Not sure what this person is doing, but it's amusing to me.I love the detail of this work. i feel like the the beautiful face of the woman adds to the beautiful things that surround her.The way the figures hands are raised looks like someone who has given up because of a ridiculous turn of events."
albrecht-durer_arm-of-lucretia,negative,"The heavy black shading feels ominous. the angle of the blame suggests self-harm.This makes me think the artist was angry at someone, possibly all o humanity.The person is holding a weapon and looks like he is going to either hurt himself or someone else."
albrecht-durer_christ-appears-to-his-mother-1511,positive,Praying to god and he hears.The god give his grace to the person.The mix of lines showing a halo vs the ragged clothes is beneficent.I feel in awe as jesus is blessing the women it warms my heart.The sunburst around the man's head makes me think that this scene is from the bible.
albrecht-durer_christ-being-nailed-to-the-cross-1511,negative,Feels sad because this looks like bible story about crucified jesus.Sad that my lord and savior is being nailed to a cross.The crucifixion scene makes me feel sad because i think it is a tragedy.
albrecht-durer_dead-bluebird-1512,negative,"The poor bird looks dead, which makes me feel sad.The bird is beautiful but there is so much sadness in the fact that it is dead.The bird appears to be dead and there's nothing else in the painting as if it's purely trying to illustrate death. this makes me sad."
albrecht-durer_deposition-engraved-passion-1512,negative,The gray and black tones mixed with the body being put into a grave give the scene an immense sadness.The man appears to have been lost and the sad expression of the others makes me feel he was loved.The corpse is being laid to eternal rest in a coffin.
albrecht-durer_design-for-all-saints-picture,positive,This is a religious image of the crucifixion and is supposed to inspire the faithful.The level of detail in this piece is astounding; you can see all the people in it.This painting feels like a statue with people praying to god for help!
albrecht-durer_frederick-the-wise-elector-of-saxony-1524,negative,"This man's beard looks like it's made of earthworms.A portrait of an old fat man with long beard and furry clothes, he looks grumpy and the background is gray.This man has disgust in his thoughts while looking sideways with raised eyebrows and pouting lips!"
albrecht-durer_madonna-nursing-1519,positive,The details are so amazin the whole thing looks real.The shimmering sparkles around the mother and child make me think about the beauty of parenthood.The glowing light surrounding the mother and childs heads is awe inspiring.
albrecht-durer_st-eustace,positive,"The animals relaxing around the man makes for a rather quaint, peaceful sight.A man kneels in front of his horse as his dogs lay around.Strangely a lot of animals in this painting, looks cool, a lot of details."
albrecht-durer_study-sheet-with-christ-as-man-of-sorrows-and-a-garment-study,negative,"The man seems somewhat tormented by the cage on top of their head. i am intrigued by the detail of their above and lack of detail below.His face is full of sadness and despair, like he is calling someone for help.Even though he was persecuted he still gave his life for all."
albrecht-durer_sudarium-spread-out-by-an-angel-1516,positive,"The angels look like they are interacting with each other and taking part in a larger story, and it makes me want to know more about the story surrounding the picture.Looks like an epic battle. intricate and exciting.  makes me feel as though i want to know the story behind it.It looks like an angel is trying to fix something in the sky."
albrecht-durer_the-cathedral-of-aix-la-chapelle-with-its-surroundings-seen-from-the-coronation-hall-1520,positive,"I'm impressed by the impressive detail that the artist sketched in, especially the fine lines for the rooftops.An elaborate detailed sketch of a city looks like building plans for new development.The details of the the buildings are made with precision."
albrecht-durer_the-dresden-altarpiece-central-panel-1496,negative,"The muted colors make this art feel very solemn. the subject matter is also sad feeling. it appears as though she is praying over a sick baby.The baby has the head of a man and its mother is already praying for the baby's health.The somber colors (maybe an underpainting?) and worried look on the woman's face make me feel that something is wrong. is the baby dead? the angels are bringing a crown, but they look sinister to me.i don't trust them."
albrecht-durer_the-great-triumphal-car-1519,positive,"The detail is incredible. despite having no colours, everything is very unique from eachother.Amazing detail and depth of the characters is awesome.Amazing skill showcasing the original wonka mobile.The royal family is being taken to the royal ball down the street."
albrecht-durer_the-harrowing-of-hell-or-christ-in-limbo-from-the-large-passion-1510,negative,"It looks like someone will be crucified in this image and that is a scary thought for that person.This looks like people are naked, and it would appear that there are very questionable things going on here. there are lions as well.It looks like all the people in the painting are suffering at least some.There seems to be a lot of pent up anguish in this artwork, for example, the sharp light coming from the man's head and the demonic creatures jeering from above.This pictures shows fear as it takes on others."
albrecht-durer_the-virgin-and-child-with-st-anne,positive,"The expression on the people's faces makes me amused.The woman on the left is wearing a garment around her head and chin and it accents her bright white eyes.The woman wearing the white has some really funny, buggy looking eyeballs and i cannot help but laugh when i look at her.The white head garment on the woman makes her look like she has a huge head and a tiny face."
